{
  "schema_version": "clinical-note-schema/v0.1.0",
  "document_status": "ai_draft",
  "source": {
    "transcript_id": "synthetic-transcript-002",
    "transcript_version": "v1"
  },
  "generation": {
    "model": "synthetic-fixture",
    "prompt_version": "clinical-extraction/v0.1.0",
    "generated_at": "2026-08-05T12:10:00Z"
  },
  "chief_complaint": [],
  "history": [],
  "examination_findings": [],
  "diagnoses_documented_by_doctor": [],
  "allergies_documented": [],
  "medications_mentioned": [],
  "medication_changes": [],
  "investigations_requested": [],
  "investigations_reviewed": [],
  "procedures_documented": [],
  "lifestyle_advice": [],
  "follow_up_plan": [],
  "patient_instructions": [],
  "uncertain_items": [
    {
      "item_id": "uncertain-1",
      "text": "Medication name is unclear",
      "source_quote": "Continue [unclear] five hundred after dinner.",
      "confidence": "low",
      "requires_verification": true,
      "evidence": {
        "segment_id": "segment-004",
        "speaker": "doctor",
        "start_ms": 8000,
        "end_ms": 11500
      },
      "uncertainty_type": "unclear_audio",
      "reason": "The medication name cannot be reliably heard.",
      "affected_paths": ["/medications_mentioned", "/medication_changes"]
    }
  ],
  "safety_flags": [
    {
      "flag_id": "flag-1",
      "code": "unclear_medication_name",
      "severity": "blocking",
      "message": "Doctor verification is required before this medication statement can be used.",
      "affected_paths": ["/uncertain_items/0"],
      "related_item_ids": ["uncertain-1"]
    }
  ]
}
